{
  "schema": 1,
  "description": "UART simulation.",
  "artifact": {
    "file": "waveform.wlf",
    "format": "wlf",
    "size": 499712,
    "sha256": "4b8bb7e5db3dd8b1817a181cfa4c9423db2c05f1b40b1a3a34774f46daeae605"
  },
  "provenance": {
    "kind": "imported",
    "source": "https://github.com/She3ro/UART_NTI-Project/blob/808ce055678d9439cbe852c754e03586cbd9a332/UART/vsim.wlf",
    "license": "unknown"
  },
  "tags": [],
  "oracle": {}
}
