{
  "schema": 1,
  "description": "Memory and interconnect test capture.",
  "artifact": {
    "file": "waveform.wdb",
    "format": "wdb",
    "size": 4054425,
    "sha256": "4c58c88d4a87600131c0fe63c7982b96923c7d48cc31f3e79124c2b40aa63211"
  },
  "provenance": {
    "kind": "imported",
    "source": "https://github.com/Bob08082002/SoC_Lab_FINAL_FALL_2025/blob/333e9da5a888e4be9f8f46e99f53cdba98de311c/SUB_PROJECT/SUBMODULE_test/distributor_v1/distributor_v1.sim/sim_1/behav/xsim/testbench_behav.wdb",
    "license": "unknown",
    "catalog_id": "WDB00184",
    "git_blob_sha1": "bae5c7c468ea3540c3ca2d3805f2d1cc5564185e",
    "toolchain": {
      "version": "2022.1",
      "evidence": "https://github.com/Bob08082002/SoC_Lab_FINAL_FALL_2025/blob/333e9da5a888e4be9f8f46e99f53cdba98de311c/SUB_PROJECT/SUBMODULE_test/distributor_v1/distributor_v1.sim/sim_1/behav/xsim/elaborate.log",
      "evidence_type": "same_simulation_directory",
      "evidence_group": "simulation_log",
      "evidence_quote": "Vivado Simulator v2022.1",
      "evidence_checked_date": "2026-10-16",
      "exact_wdb_producer_version_verified": false
    },
    "classification_basis": "Source repository, directory and test names, plus associated logs/metadata. Not a semantic parse of the WDB.",
    "semantic_validation": "not_run"
  },
  "tags": [
    "memory-interconnect",
    "rtl-behavioral",
    "bits",
    "conformance",
    "hierarchy",
    "metadata",
    "unknown-states",
    "values"
  ],
  "oracle": {
    "schema": 1,
    "open": {
      "result": "ok"
    },
    "metadata": {
      "timescale": {
        "factor": 1,
        "unit": "ps"
      }
    },
    "hierarchy": {
      "scopes": [
        {
          "path": [
            "testbench"
          ]
        }
      ],
      "variables": [
        {
          "path": [
            "testbench",
            "clk"
          ],
          "signal": "signal-1"
        },
        {
          "path": [
            "testbench",
            "rst"
          ],
          "signal": "signal-2"
        },
        {
          "path": [
            "testbench",
            "rstn"
          ],
          "signal": "signal-3"
        },
        {
          "path": [
            "testbench",
            "i_data_axis"
          ],
          "signal": "signal-4"
        },
        {
          "path": [
            "testbench",
            "i_valid_axis"
          ],
          "signal": "signal-5"
        },
        {
          "path": [
            "testbench",
            "o_ready_axis"
          ],
          "signal": "signal-6"
        },
        {
          "path": [
            "testbench",
            "o_data_input"
          ],
          "signal": "signal-7"
        },
        {
          "path": [
            "testbench",
            "o_valid_input"
          ],
          "signal": "signal-8"
        }
      ]
    },
    "signals": {
      "signal-1": {
        "encoding": {
          "kind": "bits",
          "width": 1
        },
        "samples": [
          {
            "time": "0",
            "value": {
              "bits": "0"
            }
          },
          {
            "time": "100000",
            "value": {
              "bits": "0"
            }
          },
          {
            "time": "1000035000",
            "value": {
              "bits": "1"
            }
          },
          {
            "time": "1000040000",
            "value": {
              "bits": "1"
            }
          }
        ]
      },
      "signal-2": {
        "encoding": {
          "kind": "bits",
          "width": 1
        },
        "samples": [
          {
            "time": "0",
            "value": {
              "bits": "0"
            }
          },
          {
            "time": "40000",
            "value": {
              "bits": "0"
            }
          },
          {
            "time": "100000",
            "value": {
              "bits": "0"
            }
          },
          {
            "time": "1000040000",
            "value": {
              "bits": "0"
            }
          }
        ]
      },
      "signal-3": {
        "encoding": {
          "kind": "bits",
          "width": 1
        },
        "samples": [
          {
            "time": "0",
            "value": {
              "bits": "1"
            }
          },
          {
            "time": "40000",
            "value": {
              "bits": "1"
            }
          },
          {
            "time": "100000",
            "value": {
              "bits": "1"
            }
          },
          {
            "time": "1000040000",
            "value": {
              "bits": "1"
            }
          }
        ]
      },
      "signal-4": {
        "encoding": {
          "kind": "bits",
          "width": 256
        },
        "samples": [
          {
            "time": "0",
            "value": {
              "bits": "xxxxxxxxxxxxxxxxxxxxxxxxxxxxxxxxxxxxxxxxxxxxxxxxxxxxxxxxxxxxxxxxxxxxxxxxxxxxxxxxxxxxxxxxxxxxxxxxxxxxxxxxxxxxxxxxxxxxxxxxxxxxxxxxxxxxxxxxxxxxxxxxxxxxxxxxxxxxxxxxxxxxxxxxxxxxxxxxxxxxxxxxxxxxxxxxxxxxxxxxxxxxxxxxxxxxxxxxxxxxxxxxxxxxxxxxxxxxxxxxxxxxxxxxxxxxxxxx"
            }
          },
          {
            "time": "100000",
            "value": {
              "bits": "0000000000000000000000000000000000000000000000000000000000000000000000000000000000000000000000000000000000000000000000000000000000000000000000000000000000000000000000000000000000000000000000000000000000000000000000000000000000000000000000000000000000000101"
            }
          },
          {
            "time": "1000030000",
            "value": {
              "bits": "0000000000000000000000000000000000000000000000000000000000000000000000000000000000000000000000000000000000000000000000000000000000000000000000000000000000000000000000000000000000000000000000000000000000000000000000000000000000000000000000011000011010011110"
            }
          },
          {
            "time": "1000040000",
            "value": {
              "bits": "0000000000000000000000000000000000000000000000000000000000000000000000000000000000000000000000000000000000000000000000000000000000000000000000000000000000000000000000000000000000000000000000000000000000000000000000000000000000000000000000011000011010011110"
            }
          }
        ]
      },
      "signal-5": {
        "encoding": {
          "kind": "bits",
          "width": 1
        },
        "samples": [
          {
            "time": "0",
            "value": {
              "bits": "x"
            }
          },
          {
            "time": "40000",
            "value": {
              "bits": "1"
            }
          },
          {
            "time": "100000",
            "value": {
              "bits": "1"
            }
          },
          {
            "time": "1000040000",
            "value": {
              "bits": "1"
            }
          }
        ]
      },
      "signal-6": {
        "encoding": {
          "kind": "bits",
          "width": 1
        },
        "samples": [
          {
            "time": "0",
            "value": {
              "bits": "x"
            }
          },
          {
            "time": "15000",
            "value": {
              "bits": "1"
            }
          },
          {
            "time": "100000",
            "value": {
              "bits": "1"
            }
          },
          {
            "time": "1000040000",
            "value": {
              "bits": "1"
            }
          }
        ]
      },
      "signal-7": {
        "encoding": {
          "kind": "bits",
          "width": 256
        },
        "samples": [
          {
            "time": "0",
            "value": {
              "bits": "xxxxxxxxxxxxxxxxxxxxxxxxxxxxxxxxxxxxxxxxxxxxxxxxxxxxxxxxxxxxxxxxxxxxxxxxxxxxxxxxxxxxxxxxxxxxxxxxxxxxxxxxxxxxxxxxxxxxxxxxxxxxxxxxxxxxxxxxxxxxxxxxxxxxxxxxxxxxxxxxxxxxxxxxxxxxxxxxxxxxxxxxxxxxxxxxxxxxxxxxxxxxxxxxxxxxxxxxxxxxxxxxxxxxxxxxxxxxxxxxxxxxxxxxxxxxxxxx"
            }
          },
          {
            "time": "100000",
            "value": {
              "bits": "0000000000000000000000000000000000000000000000000000000000000000000000000000000000000000000000000000000000000000000000000000000000000000000000000000000000000000000000000000000000000000000000000000000000000000000000000000000000000000000000000000000000000101"
            }
          },
          {
            "time": "1000030000",
            "value": {
              "bits": "0000000000000000000000000000000000000000000000000000000000000000000000000000000000000000000000000000000000000000000000000000000000000000000000000000000000000000000000000000000000000000000000000000000000000000000000000000000000000000000000011000011010011110"
            }
          },
          {
            "time": "1000040000",
            "value": {
              "bits": "0000000000000000000000000000000000000000000000000000000000000000000000000000000000000000000000000000000000000000000000000000000000000000000000000000000000000000000000000000000000000000000000000000000000000000000000000000000000000000000000011000011010011110"
            }
          }
        ]
      },
      "signal-8": {
        "encoding": {
          "kind": "bits",
          "width": 1
        },
        "samples": [
          {
            "time": "0",
            "value": {
              "bits": "x"
            }
          },
          {
            "time": "100000",
            "value": {
              "bits": "0"
            }
          },
          {
            "time": "939595000",
            "value": {
              "bits": "0"
            }
          },
          {
            "time": "1000040000",
            "value": {
              "bits": "0"
            }
          }
        ]
      }
    }
  }
}
