{
  "schema": 1,
  "description": "VHDL laboratory simulation.",
  "artifact": {
    "file": "waveform.wlf",
    "format": "wlf",
    "size": 40960,
    "sha256": "d7ba35ff1eef925058573e8cc5a12c1e6b6c6e21dac97a963afb3e66d48320fb"
  },
  "provenance": {
    "kind": "imported",
    "source": "https://github.com/oleander/VHDL-labs/blob/f40236f0ec066c57822228f892ddd42e0e0a9357/labb3/assign-3-1/vsim.wlf",
    "license": "unknown"
  },
  "tags": [],
  "oracle": {}
}
