{
  "schema": 1,
  "description": "Single-cycle MIPS processor simulation.",
  "artifact": {
    "file": "waveform.wlf",
    "format": "wlf",
    "size": 49152,
    "sha256": "62370b4f0801e4d8dd7a7874707b736869e767b39e29e12c1ba4a3daa4fd8124"
  },
  "provenance": {
    "kind": "imported",
    "source": "https://github.com/alyaamoh/32-bit-single-cycle-microarchitecture-MIPS-processor/blob/9e28dbc4a1711dc3584dd3f82027f418cdc868f5/wlfttamg6v",
    "license": "unknown"
  },
  "tags": [],
  "oracle": {}
}
