{
  "schema": 1,
  "description": "Programmable modulo counter simulation.",
  "artifact": {
    "file": "waveform.ghw",
    "format": "ghw",
    "size": 285516,
    "sha256": "3669ae04c07d474db0ff519f1cd6e772f144a6355a60eea570ee56dddcc1faaf"
  },
  "provenance": {
    "kind": "imported",
    "source": "https://github.com/mmazz/fgpa/blob/0e109b0133354a9bcc6c9ff9385851d105e6d567/ej2/simulation/mod_m_counter_prog_tb.ghw",
    "license": "unknown"
  },
  "tags": [],
  "oracle": {}
}
