{
  "schema": 1,
  "description": "Left barrel shifter simulation.",
  "artifact": {
    "file": "waveform.ghw",
    "format": "ghw",
    "size": 22531,
    "sha256": "d61da2fc95b321f41cdc00148c6619683f114c36be9feca704305f9c29737982"
  },
  "provenance": {
    "kind": "imported",
    "source": "https://github.com/kevoconnor/ComputerArchitecture/blob/e152b01e071744e4baa66ef0eaddf1122a7fcb1c/barrel_left_test_tb.ghw",
    "license": "unknown"
  },
  "tags": [],
  "oracle": {}
}
