{
  "schema": 1,
  "description": "Single-cycle MIPS processor simulation.",
  "artifact": {
    "file": "waveform.wlf",
    "format": "wlf",
    "size": 49152,
    "sha256": "cf1c83d99f4cb5b38327ec2215e18d32697cc69453f29d2e625a3b12cde1328e"
  },
  "provenance": {
    "kind": "imported",
    "source": "https://github.com/alyaamoh/32-bit-single-cycle-microarchitecture-MIPS-processor/blob/9e28dbc4a1711dc3584dd3f82027f418cdc868f5/wlfty4jfji",
    "license": "unknown"
  },
  "tags": [],
  "oracle": {}
}
