{
  "schema": 1,
  "description": "Cryptographic arithmetic test capture.",
  "artifact": {
    "file": "waveform.wdb",
    "format": "wdb",
    "size": 414776354,
    "sha256": "70b48bbfa90332c806010c4403413b70514c6a624300280ebf4bce4f0ec117b1"
  },
  "provenance": {
    "kind": "imported",
    "source": "https://github.com/prasit13/projects_and_others/blob/b0924ee7059c6d3533ab6f04b3ea5a2c513f5003/GF283_Itoh_Tsujii_Vivado/project_1/project_1.sim/sim_1/impl/timing/xsim/tb_gf283_top_time_impl.wdb",
    "license": "unknown",
    "catalog_id": "WDB03904",
    "toolchain": {
      "version": "2023.2",
      "evidence": "https://github.com/prasit13/projects_and_others/blob/b0924ee7059c6d3533ab6f04b3ea5a2c513f5003/GF283_Itoh_Tsujii_Vivado/project_1/project_1.sim/sim_1/impl/timing/xsim/elaborate.log",
      "evidence_type": "same_simulation_directory",
      "evidence_group": "simulation_log",
      "evidence_quote": "Vivado Simulator v2023.2",
      "evidence_checked_date": "2026-10-16",
      "exact_wdb_producer_version_verified": false
    },
    "classification_basis": "Source repository, directory and test names, plus associated logs/metadata. Not a semantic parse of the WDB.",
    "semantic_validation": "not_run"
  },
  "tags": [
    "crypto",
    "post-implementation-timing"
  ],
  "oracle": {}
}
