{
  "schema": 1,
  "description": "Port, parameter and record member controls.",
  "artifact": {
    "file": "waveform.wdb",
    "format": "wdb",
    "size": 7375,
    "sha256": "1af5e76e545c0fd84d5f1833eb6494dfdd30bd7225bb5859a076d35b46468bd5"
  },
  "provenance": {
    "kind": "authored",
    "license": "MIT"
  },
  "tags": [
    "hierarchy",
    "values"
  ],
  "oracle": {
    "schema": 1,
    "open": {
      "result": "ok"
    },
    "metadata": {
      "timescale": {
        "factor": 1,
        "unit": "ns"
      },
      "time_span": {
        "first": "0",
        "last": "20"
      }
    },
    "hierarchy": {
      "scopes": [
        {
          "path": [
            "top"
          ]
        },
        {
          "path": [
            "top",
            "dut"
          ]
        },
        {
          "path": [
            "top",
            "dut",
            "pair"
          ]
        }
      ],
      "variables": [
        {
          "path": [
            "top",
            "dut",
            "input_value"
          ],
          "signal": "signal-1",
          "direction": "input"
        },
        {
          "path": [
            "top",
            "dut",
            "output_value"
          ],
          "signal": "signal-2",
          "direction": "output"
        },
        {
          "path": [
            "top",
            "dut",
            "bidi"
          ],
          "signal": "signal-3",
          "direction": "inout"
        },
        {
          "path": [
            "top",
            "dut",
            "COUNT"
          ],
          "signal": "signal-4",
          "is_constant": true
        },
        {
          "path": [
            "top",
            "dut",
            "MASK"
          ],
          "signal": "signal-5",
          "is_constant": true
        },
        {
          "path": [
            "top",
            "dut",
            "FIXED"
          ],
          "signal": "signal-6"
        },
        {
          "path": [
            "top",
            "dut",
            "signed_bus"
          ],
          "signal": "signal-7"
        },
        {
          "path": [
            "top",
            "dut",
            "binary_bus"
          ],
          "signal": "signal-8"
        },
        {
          "path": [
            "top",
            "dut",
            "pair",
            "hi"
          ],
          "signal": "signal-9"
        },
        {
          "path": [
            "top",
            "dut",
            "pair",
            "lo"
          ],
          "signal": "signal-10"
        }
      ]
    },
    "signals": {
      "signal-1": {
        "encoding": {
          "kind": "bits",
          "width": 1
        },
        "windows": [
          {
            "start": "1",
            "end": "20",
            "initial": {
              "value": {
                "bits": "0"
              }
            },
            "changes": [
              {
                "time": "4",
                "value": {
                  "bits": "1"
                }
              },
              {
                "time": "9",
                "value": {
                  "bits": "0"
                }
              }
            ]
          }
        ]
      },
      "signal-2": {
        "encoding": {
          "kind": "bits",
          "width": 1
        },
        "windows": [
          {
            "start": "1",
            "end": "20",
            "initial": {
              "value": {
                "bits": "0"
              }
            },
            "changes": [
              {
                "time": "4",
                "value": {
                  "bits": "1"
                }
              },
              {
                "time": "9",
                "value": {
                  "bits": "0"
                }
              }
            ]
          }
        ]
      },
      "signal-3": {
        "encoding": {
          "kind": "bits",
          "width": 1
        },
        "windows": [
          {
            "start": "1",
            "end": "20",
            "initial": {
              "value": {
                "bits": "0"
              }
            },
            "changes": [
              {
                "time": "4",
                "value": {
                  "bits": "1"
                }
              },
              {
                "time": "9",
                "value": {
                  "bits": "0"
                }
              }
            ]
          }
        ]
      },
      "signal-4": {
        "encoding": {
          "kind": "bits",
          "width": 32
        },
        "windows": [
          {
            "start": "1",
            "end": "20",
            "initial": {
              "value": {
                "bits": "00000000000000000000000000000011"
              }
            },
            "changes": []
          }
        ]
      },
      "signal-5": {
        "encoding": {
          "kind": "bits",
          "width": 8
        },
        "windows": [
          {
            "start": "1",
            "end": "20",
            "initial": {
              "value": {
                "bits": "01011010"
              }
            },
            "changes": []
          }
        ]
      },
      "signal-6": {
        "encoding": {
          "kind": "bits",
          "width": 32
        },
        "windows": [
          {
            "start": "1",
            "end": "20",
            "initial": {
              "value": {
                "bits": "00000000000000000000000000001001"
              }
            },
            "changes": []
          }
        ]
      },
      "signal-7": {
        "encoding": {
          "kind": "bits",
          "width": 8
        },
        "windows": [
          {
            "start": "1",
            "end": "20",
            "initial": {
              "value": {
                "bits": "11111101"
              }
            },
            "changes": [
              {
                "time": "4",
                "value": {
                  "bits": "00000111"
                }
              }
            ]
          }
        ]
      },
      "signal-8": {
        "encoding": {
          "kind": "bits",
          "width": 16
        },
        "windows": [
          {
            "start": "1",
            "end": "20",
            "initial": {
              "value": {
                "bits": "0001001000110100"
              }
            },
            "changes": [
              {
                "time": "4",
                "value": {
                  "bits": "0100001100100001"
                }
              }
            ]
          }
        ]
      },
      "signal-9": {
        "encoding": {
          "kind": "bits",
          "width": 4
        },
        "windows": [
          {
            "start": "1",
            "end": "20",
            "initial": {
              "value": {
                "bits": "1010"
              }
            },
            "changes": [
              {
                "time": "4",
                "value": {
                  "bits": "0011"
                }
              }
            ]
          }
        ]
      },
      "signal-10": {
        "encoding": {
          "kind": "bits",
          "width": 4
        },
        "windows": [
          {
            "start": "1",
            "end": "20",
            "initial": {
              "value": {
                "bits": "0101"
              }
            },
            "changes": [
              {
                "time": "4",
                "value": {
                  "bits": "0111"
                }
              }
            ]
          }
        ]
      }
    }
  }
}
