{
  "schema": 1,
  "description": "Output register simulation.",
  "artifact": {
    "file": "waveform.ghw",
    "format": "ghw",
    "size": 590,
    "sha256": "3bb35faa77dc37a593277675b3da6ac0105414744a967a0282346ed5040a414d"
  },
  "provenance": {
    "kind": "imported",
    "source": "https://github.com/PauMarquez99/LabSistemas/blob/a33e0da35122a2353522b18309f4eeedbde34015/DataPath/OutputRegisterWave.ghw",
    "license": "unknown"
  },
  "tags": [
    "aliases",
    "bits",
    "conformance",
    "hierarchy",
    "metadata",
    "projections",
    "ranges",
    "same-time",
    "unknown-states",
    "values"
  ],
  "oracle": {
    "schema": 1,
    "open": {
      "result": "ok"
    },
    "metadata": {
      "timescale": {
        "factor": 1,
        "unit": "fs"
      },
      "time_span": {
        "first": "0",
        "last": "50000000"
      },
      "writer": null,
      "date": null
    },
    "hierarchy": {
      "scopes": [
        {
          "path": [
            "outputregister_tb"
          ],
          "kind": "instance"
        },
        {
          "path": [
            "outputregister_tb",
            "uut"
          ],
          "kind": "instance"
        }
      ],
      "variables": [
        {
          "path": [
            "outputregister_tb",
            "clk"
          ],
          "kind": "signal",
          "direction": "implicit",
          "type_name": "std_logic",
          "signal": "signal-1"
        },
        {
          "path": [
            "outputregister_tb",
            "o_enb"
          ],
          "kind": "signal",
          "direction": "implicit",
          "type_name": "std_logic",
          "signal": "signal-2"
        },
        {
          "path": [
            "outputregister_tb",
            "input"
          ],
          "kind": "signal",
          "direction": "implicit",
          "type_name": "std_logic_vector",
          "range": {
            "msb": 3,
            "lsb": 0
          },
          "signal": "signal-3"
        },
        {
          "path": [
            "outputregister_tb",
            "data_o"
          ],
          "kind": "signal",
          "direction": "implicit",
          "type_name": "std_logic_vector",
          "range": {
            "msb": 3,
            "lsb": 0
          },
          "signal": "signal-4"
        },
        {
          "path": [
            "outputregister_tb",
            "uut",
            "clk"
          ],
          "kind": "port",
          "direction": "input",
          "type_name": "std_logic",
          "signal": "signal-1"
        },
        {
          "path": [
            "outputregister_tb",
            "uut",
            "o_enb"
          ],
          "kind": "port",
          "direction": "input",
          "type_name": "std_logic",
          "signal": "signal-2"
        },
        {
          "path": [
            "outputregister_tb",
            "uut",
            "input"
          ],
          "kind": "port",
          "direction": "input",
          "type_name": "std_logic_vector",
          "range": {
            "msb": 3,
            "lsb": 0
          },
          "signal": "signal-3"
        },
        {
          "path": [
            "outputregister_tb",
            "uut",
            "data_o"
          ],
          "kind": "port",
          "direction": "output",
          "type_name": "std_logic_vector",
          "range": {
            "msb": 3,
            "lsb": 0
          },
          "signal": "signal-4"
        }
      ]
    },
    "signals": {
      "signal-1": {
        "encoding": {
          "kind": "bits",
          "width": 1
        },
        "windows": [
          {
            "start": "0",
            "end": "50000000",
            "initial": null,
            "changes": [
              {
                "time": "0",
                "value": {
                  "bits": "u"
                }
              },
              {
                "time": "0",
                "value": {
                  "bits": "1"
                }
              },
              {
                "time": "5000000",
                "value": {
                  "bits": "0"
                }
              },
              {
                "time": "10000000",
                "value": {
                  "bits": "1"
                }
              },
              {
                "time": "15000000",
                "value": {
                  "bits": "0"
                }
              },
              {
                "time": "20000000",
                "value": {
                  "bits": "1"
                }
              },
              {
                "time": "25000000",
                "value": {
                  "bits": "0"
                }
              },
              {
                "time": "30000000",
                "value": {
                  "bits": "1"
                }
              },
              {
                "time": "35000000",
                "value": {
                  "bits": "0"
                }
              },
              {
                "time": "40000000",
                "value": {
                  "bits": "1"
                }
              },
              {
                "time": "45000000",
                "value": {
                  "bits": "0"
                }
              },
              {
                "time": "50000000",
                "value": {
                  "bits": "1"
                }
              }
            ]
          }
        ]
      },
      "signal-2": {
        "encoding": {
          "kind": "bits",
          "width": 1
        },
        "windows": [
          {
            "start": "0",
            "end": "50000000",
            "initial": null,
            "changes": [
              {
                "time": "0",
                "value": {
                  "bits": "u"
                }
              },
              {
                "time": "0",
                "value": {
                  "bits": "1"
                }
              },
              {
                "time": "20000000",
                "value": {
                  "bits": "0"
                }
              },
              {
                "time": "30000000",
                "value": {
                  "bits": "1"
                }
              },
              {
                "time": "50000000",
                "value": {
                  "bits": "0"
                }
              }
            ]
          }
        ]
      },
      "signal-3": {
        "encoding": {
          "kind": "bits",
          "width": 4
        },
        "windows": [
          {
            "start": "0",
            "end": "50000000",
            "initial": null,
            "changes": [
              {
                "time": "0",
                "value": {
                  "bits": "uuuu"
                }
              },
              {
                "time": "0",
                "value": {
                  "bits": "1001"
                }
              },
              {
                "time": "10000000",
                "value": {
                  "bits": "1011"
                }
              },
              {
                "time": "30000000",
                "value": {
                  "bits": "1001"
                }
              },
              {
                "time": "40000000",
                "value": {
                  "bits": "1011"
                }
              }
            ]
          }
        ]
      },
      "signal-4": {
        "encoding": {
          "kind": "bits",
          "width": 4
        },
        "windows": [
          {
            "start": "0",
            "end": "50000000",
            "initial": null,
            "changes": [
              {
                "time": "0",
                "value": {
                  "bits": "uuuu"
                }
              },
              {
                "time": "0",
                "value": {
                  "bits": "1001"
                }
              },
              {
                "time": "10000000",
                "value": {
                  "bits": "1011"
                }
              },
              {
                "time": "20000000",
                "value": {
                  "bits": "0000"
                }
              },
              {
                "time": "30000000",
                "value": {
                  "bits": "1001"
                }
              },
              {
                "time": "40000000",
                "value": {
                  "bits": "1011"
                }
              },
              {
                "time": "50000000",
                "value": {
                  "bits": "0000"
                }
              }
            ]
          }
        ]
      }
    }
  }
}
