{
  "schema": 1,
  "description": "Adams Bridge norm-check stale shuffle state FSDB.",
  "artifact": {
    "file": "waveform.fsdb",
    "format": "fsdb",
    "size": 12173,
    "sha256": "bb727f829bfe988604e74e2fd7f3f6e3b48e0388cda1abc8275717d4568ca091"
  },
  "provenance": {
    "kind": "imported",
    "source": "https://github.com/chipsalliance/adams-bridge/issues/96",
    "license": "unknown"
  },
  "tags": [],
  "oracle": {}
}
