{
  "schema": 1,
  "description": "Eight-input multiplexer using selected assignments.",
  "artifact": {
    "file": "waveform.ghw",
    "format": "ghw",
    "size": 617,
    "sha256": "145ec163e5d795ddebb47b166f0a986fb516f4d14813c9a52b901410babeee22"
  },
  "provenance": {
    "kind": "imported",
    "source": "https://github.com/JulyWitch/vhdl_ghdl_examples/blob/60e216d12a29e1f251e9f8ccb4603f78a4b1ce08/waves/mux8x1_sel_test.ghw",
    "license": "unknown"
  },
  "tags": [
    "aliases",
    "bits",
    "conformance",
    "hierarchy",
    "metadata",
    "projections",
    "ranges",
    "same-time",
    "unknown-states",
    "values"
  ],
  "oracle": {
    "schema": 1,
    "open": {
      "result": "ok"
    },
    "metadata": {
      "timescale": {
        "factor": 1,
        "unit": "fs"
      },
      "time_span": {
        "first": "0",
        "last": "381000000"
      },
      "writer": null,
      "date": null
    },
    "hierarchy": {
      "scopes": [
        {
          "path": [
            "mux8x1_sel_test"
          ],
          "kind": "instance"
        },
        {
          "path": [
            "mux8x1_sel_test",
            "uut"
          ],
          "kind": "instance"
        }
      ],
      "variables": [
        {
          "path": [
            "mux8x1_sel_test",
            "x"
          ],
          "kind": "signal",
          "direction": "implicit",
          "type_name": "std_ulogic_vector",
          "range": {
            "msb": 7,
            "lsb": 0
          },
          "signal": "signal-1"
        },
        {
          "path": [
            "mux8x1_sel_test",
            "sel"
          ],
          "kind": "signal",
          "direction": "implicit",
          "type_name": "std_ulogic_vector",
          "range": {
            "msb": 2,
            "lsb": 0
          },
          "signal": "signal-2"
        },
        {
          "path": [
            "mux8x1_sel_test",
            "y"
          ],
          "kind": "signal",
          "direction": "implicit",
          "type_name": "std_logic",
          "signal": "signal-3"
        },
        {
          "path": [
            "mux8x1_sel_test",
            "uut",
            "sel"
          ],
          "kind": "port",
          "direction": "input",
          "type_name": "std_ulogic_vector",
          "range": {
            "msb": 2,
            "lsb": 0
          },
          "signal": "signal-2"
        },
        {
          "path": [
            "mux8x1_sel_test",
            "uut",
            "x"
          ],
          "kind": "port",
          "direction": "input",
          "type_name": "std_ulogic_vector",
          "range": {
            "msb": 7,
            "lsb": 0
          },
          "signal": "signal-1"
        },
        {
          "path": [
            "mux8x1_sel_test",
            "uut",
            "y"
          ],
          "kind": "port",
          "direction": "output",
          "type_name": "std_logic",
          "signal": "signal-3"
        }
      ]
    },
    "signals": {
      "signal-1": {
        "encoding": {
          "kind": "bits",
          "width": 8
        },
        "windows": [
          {
            "start": "0",
            "end": "381000000",
            "initial": null,
            "changes": [
              {
                "time": "0",
                "value": {
                  "bits": "00000000"
                }
              },
              {
                "time": "0",
                "value": {
                  "bits": "00000001"
                }
              },
              {
                "time": "60000000",
                "value": {
                  "bits": "00000000"
                }
              },
              {
                "time": "60500000",
                "value": {
                  "bits": "00000001"
                }
              },
              {
                "time": "90500000",
                "value": {
                  "bits": "00000000"
                }
              },
              {
                "time": "190500000",
                "value": {
                  "bits": "00000010"
                }
              },
              {
                "time": "250500000",
                "value": {
                  "bits": "00000000"
                }
              },
              {
                "time": "251000000",
                "value": {
                  "bits": "00000010"
                }
              },
              {
                "time": "281000000",
                "value": {
                  "bits": "00000000"
                }
              },
              {
                "time": "381000000",
                "value": {
                  "bits": "00000001"
                }
              }
            ]
          }
        ]
      },
      "signal-2": {
        "encoding": {
          "kind": "bits",
          "width": 3
        },
        "windows": [
          {
            "start": "0",
            "end": "381000000",
            "initial": null,
            "changes": [
              {
                "time": "0",
                "value": {
                  "bits": "000"
                }
              },
              {
                "time": "190500000",
                "value": {
                  "bits": "001"
                }
              },
              {
                "time": "381000000",
                "value": {
                  "bits": "000"
                }
              }
            ]
          }
        ]
      },
      "signal-3": {
        "encoding": {
          "kind": "bits",
          "width": 1
        },
        "windows": [
          {
            "start": "0",
            "end": "381000000",
            "initial": null,
            "changes": [
              {
                "time": "0",
                "value": {
                  "bits": "u"
                }
              },
              {
                "time": "50000000",
                "value": {
                  "bits": "1"
                }
              },
              {
                "time": "110000000",
                "value": {
                  "bits": "0"
                }
              },
              {
                "time": "110500000",
                "value": {
                  "bits": "1"
                }
              },
              {
                "time": "140500000",
                "value": {
                  "bits": "0"
                }
              },
              {
                "time": "240500000",
                "value": {
                  "bits": "1"
                }
              },
              {
                "time": "300500000",
                "value": {
                  "bits": "0"
                }
              },
              {
                "time": "301000000",
                "value": {
                  "bits": "1"
                }
              },
              {
                "time": "331000000",
                "value": {
                  "bits": "0"
                }
              }
            ]
          }
        ]
      }
    }
  }
}
