{
  "schema": 1,
  "description": "Register tutorial simulation.",
  "artifact": {
    "file": "waveform.wlf",
    "format": "wlf",
    "size": 49152,
    "sha256": "36f613bb79aa079f5a67dfb329021f508939ca0679ef5e68fe57413deb03a92c"
  },
  "provenance": {
    "kind": "imported",
    "source": "https://github.com/MohamedReda2003/FPGA-Tutorials/blob/8cc01d40570ad362595c724a51bb6f983fcbfa70/1-tuto_modelsim/Registre/vsim.wlf",
    "license": "unknown"
  },
  "tags": [],
  "oracle": {}
}
