{
  "schema": 1,
  "description": "Image processing simulation.",
  "artifact": {
    "file": "waveform.fsdb",
    "format": "fsdb",
    "size": 153707,
    "sha256": "1ce6a73f4e337f4e3a82343c289e40f0e46802935f0a2c73b6199fc827e21568"
  },
  "provenance": {
    "kind": "imported",
    "source": "https://github.com/derek8955/spring_iclab/blob/166cb59d950f6aa48029b468b422a45d049db9ac/Lab05/01_RTL/TMIP.fsdb",
    "license": "unknown"
  },
  "tags": [],
  "oracle": {}
}
