{
  "schema": 1,
  "description": "Simulation with initial signal values only.",
  "artifact": {
    "file": "waveform.fsdb",
    "format": "fsdb",
    "size": 29376,
    "sha256": "dd485700da5abd9e86c6065cc87e87f031833b83b997b39637c9f49f38487d01"
  },
  "provenance": {
    "kind": "imported",
    "source": "https://github.com/derek8955/ic_contest/blob/dfb6cc65753f994ef89d4ade054c0bf228de5e1d/final/2015_ISE/01_RTL/ISE.fsdb",
    "license": "unknown"
  },
  "tags": [],
  "oracle": {}
}
